{
  "schemaVersion": 1,
  "suite": "vault-scale-startup",
  "generatedAt": "2026-08-14T12:55:43.456Z",
  "status": "aborted",
  "runtime": {
    "node": "v22.22.2",
    "electron": "43.3.0",
    "threadleaf": "0.1.0-beta.3",
    "platform": "linux",
    "arch": "x64",
    "gitHead": "7f4d9f77ebc2e6ddd179e9c46d5d6b07f9e8c9a9",
    "gitDirty": false,
    "branch": "lane/vault-scale-benchmark"
  },
  "environment": {
    "display": "xvfb",
    "ozonePlatform": "x11",
    "gpuDisabled": true,
    "cpuCount": 16,
    "cpuModel": "AMD Ryzen 7 5800X3D 8-Core Processor",
    "kernel": "7.1.8-200.fc44.x86_64",
    "memoryTotalBytes": 67321507840
  },
  "corpus": {
    "variant": "full",
    "generatorVersion": "1.0.0",
    "seed": 1414025796,
    "fileCount": 207726,
    "visibleFileCount": 206702,
    "hiddenFileCount": 1024,
    "markdownFileCount": 21145,
    "ballastFileCount": 186581,
    "totalBytes": 897160700,
    "manifestSampleHash": "31855970c3df040247890f6eec1feeb3df6606adb2ccefa8afb004149632e32f",
    "noteSizeDistribution": {
      "p50Bytes": 10240,
      "p90Bytes": 37888,
      "p99Bytes": 156672,
      "maximumBytes": 1228800,
      "buckets": [
        {
          "label": "p50",
          "count": 11200,
          "minimumBytes": 10240,
          "maximumBytes": 10240
        },
        {
          "label": "p90",
          "count": 7900,
          "minimumBytes": 37888,
          "maximumBytes": 37888
        },
        {
          "label": "p99",
          "count": 1834,
          "minimumBytes": 156672,
          "maximumBytes": 156672
        },
        {
          "label": "tail",
          "count": 210,
          "minimumBytes": 174080,
          "maximumBytes": 1224998
        },
        {
          "label": "max",
          "count": 1,
          "minimumBytes": 1228800,
          "maximumBytes": 1228800
        }
      ]
    },
    "depthProfile": {
      "minimum": 3,
      "maximum": 10,
      "p50": 10,
      "p90": 10,
      "atLeast10": 206702
    },
    "extensionCounts": {
      ".md": 21145,
      ".js": 68000,
      ".ts": 34000,
      ".map": 28000,
      ".json": 23000,
      "[none]": 11000,
      ".mdx": 9600,
      ".mjs": 4500,
      ".png": 4300,
      ".css": 1200,
      ".svg": 900,
      ".canvas": 900,
      ".html": 700,
      ".bin": 481
    }
  },
  "configuration": {
    "runs": 2,
    "timeoutMs": 600000,
    "display": "xvfb",
    "ozonePlatform": "x11",
    "gpuDisabled": true,
    "coldDefinition": "Fresh Electron user-data root per run; OS page cache is not flushed.",
    "warmDefinition": "Relaunch of the same user-data root after the cold launch; workspace state and OS caches persist, while the base branch has no persisted metadata-index cache.",
    "incrementalDefinition": "External file edits while the real watcher is active; convergence ends when search observes the marker and the index generation includes every changed note."
  },
  "correctness": [
    {
      "name": "measurement-completion",
      "status": "aborted",
      "details": "The matrix stopped before all requested runs completed: full cold run 1 failed: CDP WebSocket closed."
    }
  ],
  "runs": [
    {
      "status": "aborted",
      "runIndex": 1,
      "kernel": {
        "status": "aborted",
        "failureClass": "no-json-result",
        "message": "The headless kernel process exited before emitting JSON during the same cold-index attempt after reaching approximately 4 GiB RSS."
      },
      "cold": {
        "status": "aborted",
        "mode": "cold",
        "runIndex": 1,
        "error": "full cold run 1 failed: CDP WebSocket closed.",
        "partial": {
          "mode": "cold",
          "runIndex": 1,
          "startup": {
            "shellReadyMs": 5395.10009765625,
            "openingSurfaceMs": 5408,
            "usableShellMs": 5395.10009765625,
            "readyMs": null,
            "openingObserved": true,
            "summary": null,
            "surface": {
              "bodyVisible": true,
              "shellReady": true,
              "shellMark": 1287.300000000745,
              "shellTimeOrigin": 1786711612211.8,
              "targetPath": "/home/maher/worktrees/.bench-corpus/threadleaf-vault-scale-v1/full/vault",
              "runtimeState": "Opening",
              "indexStatus": "Indexing",
              "statusShape": "opening",
              "openVaultDisabled": false,
              "newNoteDisabled": true,
              "fileSearchDisabled": true
            }
          },
          "memorySafety": {
            "minimumAvailableBytes": 31587131392,
            "thresholdBytes": 4294967296,
            "tripped": null
          }
        }
      },
      "warm": null
    }
  ],
  "agreement": {
    "runs": 1,
    "bounds": {
      "timingRelativeSpread": 0.25,
      "incrementalTimingRelativeSpread": 0.35,
      "memoryRelativeSpread": 0.2,
      "responsivenessRelativeSpread": 0.5
    },
    "status": "insufficient-runs",
    "metrics": []
  },
  "error": {
    "message": "full cold run 1 failed: CDP WebSocket closed.",
    "completedRuns": 0,
    "observedRuns": 1,
    "kernelError": {
      "status": "aborted",
      "failureClass": "no-json-result",
      "message": "The headless kernel process exited before emitting JSON during the same cold-index attempt after reaching approximately 4 GiB RSS."
    },
    "partial": {
      "mode": "cold",
      "runIndex": 1,
      "startup": {
        "shellReadyMs": 5395.10009765625,
        "openingSurfaceMs": 5408,
        "usableShellMs": 5395.10009765625,
        "readyMs": null,
        "openingObserved": true,
        "summary": null,
        "surface": {
          "bodyVisible": true,
          "shellReady": true,
          "shellMark": 1287.300000000745,
          "shellTimeOrigin": 1786711612211.8,
          "targetPath": "/home/maher/worktrees/.bench-corpus/threadleaf-vault-scale-v1/full/vault",
          "runtimeState": "Opening",
          "indexStatus": "Indexing",
          "statusShape": "opening",
          "openVaultDisabled": false,
          "newNoteDisabled": true,
          "fileSearchDisabled": true
        }
      },
      "memorySafety": {
        "minimumAvailableBytes": 31587131392,
        "thresholdBytes": 4294967296,
        "tripped": null
      }
    }
  },
  "limitations": [
    "This lane measures only synthetic corpora and never reads the real daily-driver vault.",
    "These are Linux/Xvfb observations with Electron GPU disabled; they are not Windows, macOS, or universal desktop SLAs.",
    "Cold launches create fresh user-data roots but do not flush the kernel filesystem cache.",
    "Warm restart persists Threadleaf user-data/workspace state, but this base revision does not persist or reload a metadata index; the warm number therefore isolates restart behavior plus warm filesystem/runtime state, not an on-disk index-cache hit.",
    "The usable-shell timestamp is the renderer shell-ready mark. The separate opening-surface timestamp records when the target vault became visible, while background completion is the target DOM Ready state after index and workspace projection converge.",
    "Memory is Linux /proc VmRSS for the Electron browser and descendant renderer processes. It is not a JavaScript heap or leak proof.",
    "Renderer heartbeat pauses measure the renderer event loop. The headless kernel record separately measures Node event-loop pauses during scan, index, projection, and incremental work.",
    "The checked-in Obsidian baseline is context only. It is not a pass/fail budget for Threadleaf."
  ]
}
